{
  "schemaVersion": 1,
  "verifiedAt": "2026-08-17T01:06:23.740Z",
  "runId": "20260817T010503Z__usda-nrcs-plants__651f872c72f3",
  "sourceId": "usda-nrcs-plants",
  "stateCode": "HI",
  "pairKeys": [
    "15001:nassella-neesiana",
    "15001:nepeta-cataria",
    "15001:nephrolepis-cordifolia",
    "15001:nerium-oleander",
    "15001:nicotiana-glauca",
    "15001:oxalis-debilis",
    "15001:paspalum-dilatatum",
    "15001:paspalum-urvillei",
    "15001:peperomia-pellucida",
    "15001:perilla-frutescens",
    "15001:phalaris-minor",
    "15001:phyllanthus-tenellus",
    "15001:phyllanthus-urinaria",
    "15001:polypogon-monspeliensis",
    "15001:prunus-persica",
    "15001:pteris-vittata",
    "15001:pyracantha-fortuneana",
    "15001:pyracantha-koidzumii",
    "15001:ranunculus-arvensis",
    "15001:ranunculus-muricatus",
    "15001:ranunculus-parviflorus",
    "15001:ranunculus-sardous",
    "15001:raphanus-sativus",
    "15001:rosa-bracteata",
    "15001:rosa-laevigata",
    "15001:rosa-rubiginosa",
    "15001:rumex-conglomeratus",
    "15001:rumex-crispus",
    "15001:rumex-obtusifolius",
    "15001:salix-cinerea",
    "15001:schedonorus-pratensis",
    "15001:senna-occidentalis",
    "15001:setaria-viridis",
    "15001:sherardia-arvensis",
    "15001:sida-urens",
    "15001:sisymbrium-officinale",
    "15001:solanum-capsicoides",
    "15001:solanum-lycopersicum",
    "15001:solanum-nigrescens",
    "15001:solanum-nigrum",
    "15003:nassella-neesiana",
    "15003:nepeta-cataria",
    "15003:nephrolepis-cordifolia",
    "15003:nerium-oleander",
    "15003:nicotiana-glauca",
    "15003:oxalis-debilis",
    "15003:paspalum-dilatatum",
    "15003:paspalum-urvillei",
    "15003:peperomia-pellucida",
    "15003:perilla-frutescens",
    "15003:phalaris-minor",
    "15003:phyllanthus-tenellus",
    "15003:phyllanthus-urinaria",
    "15003:polypogon-monspeliensis",
    "15003:prunus-persica",
    "15003:pteris-vittata",
    "15003:pyracantha-fortuneana",
    "15003:pyracantha-koidzumii",
    "15003:ranunculus-arvensis",
    "15003:ranunculus-muricatus",
    "15003:ranunculus-parviflorus",
    "15003:ranunculus-sardous",
    "15003:raphanus-sativus",
    "15003:rosa-bracteata",
    "15003:rosa-laevigata",
    "15003:rosa-rubiginosa",
    "15003:rumex-conglomeratus",
    "15003:rumex-crispus",
    "15003:rumex-obtusifolius",
    "15003:salix-cinerea",
    "15003:schedonorus-pratensis",
    "15003:senna-occidentalis",
    "15003:setaria-viridis",
    "15003:sherardia-arvensis",
    "15003:sida-urens",
    "15003:sisymbrium-officinale",
    "15003:solanum-capsicoides",
    "15003:solanum-lycopersicum",
    "15003:solanum-nigrescens",
    "15003:solanum-nigrum",
    "15005:nassella-neesiana",
    "15005:nepeta-cataria",
    "15005:nephrolepis-cordifolia",
    "15005:nerium-oleander",
    "15005:nicotiana-glauca",
    "15005:oxalis-debilis",
    "15005:paspalum-dilatatum",
    "15005:paspalum-urvillei",
    "15005:peperomia-pellucida",
    "15005:perilla-frutescens",
    "15005:phalaris-minor",
    "15005:phyllanthus-tenellus",
    "15005:phyllanthus-urinaria",
    "15005:polypogon-monspeliensis",
    "15005:prunus-persica",
    "15005:pteris-vittata",
    "15005:pyracantha-fortuneana",
    "15005:pyracantha-koidzumii",
    "15005:ranunculus-arvensis",
    "15005:ranunculus-muricatus",
    "15005:ranunculus-parviflorus",
    "15005:ranunculus-sardous",
    "15005:raphanus-sativus",
    "15005:rosa-bracteata",
    "15005:rosa-laevigata",
    "15005:rosa-rubiginosa",
    "15005:rumex-conglomeratus",
    "15005:rumex-crispus",
    "15005:rumex-obtusifolius",
    "15005:salix-cinerea",
    "15005:schedonorus-pratensis",
    "15005:senna-occidentalis",
    "15005:setaria-viridis",
    "15005:sherardia-arvensis",
    "15005:sida-urens",
    "15005:sisymbrium-officinale",
    "15005:solanum-capsicoides",
    "15005:solanum-lycopersicum",
    "15005:solanum-nigrescens",
    "15005:solanum-nigrum",
    "15007:nassella-neesiana",
    "15007:nepeta-cataria",
    "15007:nephrolepis-cordifolia",
    "15007:nerium-oleander",
    "15007:nicotiana-glauca",
    "15007:oxalis-debilis",
    "15007:paspalum-dilatatum",
    "15007:paspalum-urvillei",
    "15007:peperomia-pellucida",
    "15007:perilla-frutescens",
    "15007:phalaris-minor",
    "15007:phyllanthus-tenellus",
    "15007:phyllanthus-urinaria",
    "15007:polypogon-monspeliensis",
    "15007:prunus-persica",
    "15007:pteris-vittata",
    "15007:pyracantha-fortuneana",
    "15007:pyracantha-koidzumii",
    "15007:ranunculus-arvensis",
    "15007:ranunculus-muricatus",
    "15007:ranunculus-parviflorus",
    "15007:ranunculus-sardous",
    "15007:raphanus-sativus",
    "15007:rosa-bracteata",
    "15007:rosa-laevigata",
    "15007:rosa-rubiginosa",
    "15007:rumex-conglomeratus",
    "15007:rumex-crispus",
    "15007:rumex-obtusifolius",
    "15007:salix-cinerea",
    "15007:schedonorus-pratensis",
    "15007:senna-occidentalis",
    "15007:setaria-viridis",
    "15007:sherardia-arvensis",
    "15007:sida-urens",
    "15007:sisymbrium-officinale",
    "15007:solanum-capsicoides",
    "15007:solanum-lycopersicum",
    "15007:solanum-nigrescens",
    "15007:solanum-nigrum",
    "15009:nassella-neesiana",
    "15009:nepeta-cataria",
    "15009:nephrolepis-cordifolia",
    "15009:nerium-oleander",
    "15009:nicotiana-glauca",
    "15009:oxalis-debilis",
    "15009:paspalum-dilatatum",
    "15009:paspalum-urvillei",
    "15009:peperomia-pellucida",
    "15009:perilla-frutescens",
    "15009:phalaris-minor",
    "15009:phyllanthus-tenellus",
    "15009:phyllanthus-urinaria",
    "15009:polypogon-monspeliensis",
    "15009:prunus-persica",
    "15009:pteris-vittata",
    "15009:pyracantha-fortuneana",
    "15009:pyracantha-koidzumii",
    "15009:ranunculus-arvensis",
    "15009:ranunculus-muricatus",
    "15009:ranunculus-parviflorus",
    "15009:ranunculus-sardous",
    "15009:raphanus-sativus",
    "15009:rosa-bracteata",
    "15009:rosa-laevigata",
    "15009:rosa-rubiginosa",
    "15009:rumex-conglomeratus",
    "15009:rumex-crispus",
    "15009:rumex-obtusifolius",
    "15009:salix-cinerea",
    "15009:schedonorus-pratensis",
    "15009:senna-occidentalis",
    "15009:setaria-viridis",
    "15009:sherardia-arvensis",
    "15009:sida-urens",
    "15009:sisymbrium-officinale",
    "15009:solanum-capsicoides",
    "15009:solanum-lycopersicum",
    "15009:solanum-nigrescens",
    "15009:solanum-nigrum"
  ],
  "parameterHash": "4d610a458563d39936fdb3c0531c601085eee49175728be7e5350b03442a956f",
  "authority": {
    "name": "USDA Natural Resources Conservation Service",
    "sourceUrl": "https://plantsservices.sc.egov.usda.gov/api/PlantProfile/getDownloadDistributionDocumentation",
    "publisher": "USDA NRCS"
  },
  "terms": {
    "license": "Official USDA NRCS service; no dataset-specific machine-readable license was exposed. Copyright attribution and exact source bytes are retained.",
    "termsUrl": "https://plants.usda.gov/home/help",
    "retentionAllowed": true
  },
  "availability": {
    "status": "available",
    "checkedAt": "2026-08-17T01:06:23.740Z",
    "freshnessDate": "2026-08-16"
  },
  "geography": {
    "method": "Exact provider-declared state and county FIPS plus matching registered active state and county-equivalent names.",
    "countyEquivalentSupported": true,
    "coordinatePolicy": "Coordinates, MapServer cross-layer ID joins, and automatic retired-geography crosswalks are prohibited."
  },
  "taxonomy": {
    "method": "Exact committed PLANTS master ID, accepted profile, symbol, scientific name, and L48 Introduced status.",
    "targetSpeciesIds": [
      "nassella-neesiana",
      "nepeta-cataria",
      "nephrolepis-cordifolia",
      "nerium-oleander",
      "nicotiana-glauca",
      "oxalis-debilis",
      "paspalum-dilatatum",
      "paspalum-urvillei",
      "peperomia-pellucida",
      "perilla-frutescens",
      "phalaris-minor",
      "phyllanthus-tenellus",
      "phyllanthus-urinaria",
      "polypogon-monspeliensis",
      "prunus-persica",
      "pteris-vittata",
      "pyracantha-fortuneana",
      "pyracantha-koidzumii",
      "ranunculus-arvensis",
      "ranunculus-muricatus",
      "ranunculus-parviflorus",
      "ranunculus-sardous",
      "raphanus-sativus",
      "rosa-bracteata",
      "rosa-laevigata",
      "rosa-rubiginosa",
      "rumex-conglomeratus",
      "rumex-crispus",
      "rumex-obtusifolius",
      "salix-cinerea",
      "schedonorus-pratensis",
      "senna-occidentalis",
      "setaria-viridis",
      "sherardia-arvensis",
      "sida-urens",
      "sisymbrium-officinale",
      "solanum-capsicoides",
      "solanum-lycopersicum",
      "solanum-nigrescens",
      "solanum-nigrum"
    ]
  },
  "acquisition": {
    "snapshotComplete": true,
    "paginationComplete": true,
    "stableIdentityFields": [
      "plantMasterId",
      "Symbol",
      "State FIP",
      "County FIP"
    ],
    "requests": []
  },
  "negativeEvidence": {
    "supportsVerifiedAbsence": false,
    "supportsNotDetected": false,
    "limitations": [
      "PLANTS distribution rows are positive occurrence documentation, not a negative survey.",
      "Source silence, failure, rejection, missing geography, and state-only rows never create absence or non-detection."
    ]
  },
  "retainedEvidence": [
    {
      "path": "src/data/research/runs/20260817T010503Z__usda-nrcs-plants__651f872c72f3/artifacts/national-acquisition-reference.json",
      "sha256": "6c839c45f77365e791937f2ca42fc2bc9722caac10013271877f83bbc19cd293",
      "bytes": 33531
    }
  ],
  "caveats": [
    "County distribution documentation supports occurrence. Missing counties do not imply absence.",
    "The official mutable service was acquired once as 40 complete taxon-bounded CSV responses guarded by profile and source-status fingerprints.",
    "No dataset-specific machine-readable license or row date was exposed."
  ]
}
