{
  "schemaVersion": 1,
  "verifiedAt": "2026-08-18T01:56:24.535Z",
  "runId": "20260818T015248Z__gbif-preserved-specimens__900d2990fb62",
  "sourceId": "gbif-preserved-specimens",
  "stateCode": "IN",
  "pairKeys": [
    "18001:callitriche-stagnalis",
    "18001:marsilea-quadrifolia",
    "18003:callitriche-stagnalis",
    "18003:marsilea-quadrifolia",
    "18005:callitriche-stagnalis",
    "18005:marsilea-quadrifolia",
    "18007:callitriche-stagnalis",
    "18007:marsilea-quadrifolia",
    "18009:callitriche-stagnalis",
    "18009:marsilea-quadrifolia",
    "18011:callitriche-stagnalis",
    "18011:marsilea-quadrifolia",
    "18013:callitriche-stagnalis",
    "18013:marsilea-quadrifolia",
    "18015:callitriche-stagnalis",
    "18015:marsilea-quadrifolia",
    "18017:callitriche-stagnalis",
    "18017:marsilea-quadrifolia",
    "18019:callitriche-stagnalis",
    "18019:marsilea-quadrifolia",
    "18021:callitriche-stagnalis",
    "18021:marsilea-quadrifolia",
    "18023:callitriche-stagnalis",
    "18023:marsilea-quadrifolia",
    "18025:callitriche-stagnalis",
    "18025:marsilea-quadrifolia",
    "18027:callitriche-stagnalis",
    "18027:marsilea-quadrifolia",
    "18029:callitriche-stagnalis",
    "18029:marsilea-quadrifolia",
    "18031:callitriche-stagnalis",
    "18031:marsilea-quadrifolia",
    "18033:callitriche-stagnalis",
    "18033:marsilea-quadrifolia",
    "18035:callitriche-stagnalis",
    "18035:marsilea-quadrifolia",
    "18037:callitriche-stagnalis",
    "18037:marsilea-quadrifolia",
    "18039:callitriche-stagnalis",
    "18039:marsilea-quadrifolia",
    "18041:callitriche-stagnalis",
    "18041:marsilea-quadrifolia",
    "18043:callitriche-stagnalis",
    "18043:marsilea-quadrifolia",
    "18045:callitriche-stagnalis",
    "18045:marsilea-quadrifolia",
    "18047:callitriche-stagnalis",
    "18047:marsilea-quadrifolia",
    "18049:callitriche-stagnalis",
    "18049:marsilea-quadrifolia",
    "18051:callitriche-stagnalis",
    "18051:marsilea-quadrifolia",
    "18053:callitriche-stagnalis",
    "18053:marsilea-quadrifolia",
    "18055:callitriche-stagnalis",
    "18055:marsilea-quadrifolia",
    "18057:callitriche-stagnalis",
    "18057:marsilea-quadrifolia",
    "18059:callitriche-stagnalis",
    "18059:marsilea-quadrifolia",
    "18061:callitriche-stagnalis",
    "18061:marsilea-quadrifolia",
    "18063:callitriche-stagnalis",
    "18063:marsilea-quadrifolia",
    "18065:callitriche-stagnalis",
    "18065:marsilea-quadrifolia",
    "18067:callitriche-stagnalis",
    "18067:marsilea-quadrifolia",
    "18069:callitriche-stagnalis",
    "18069:marsilea-quadrifolia",
    "18071:callitriche-stagnalis",
    "18071:marsilea-quadrifolia",
    "18073:callitriche-stagnalis",
    "18073:marsilea-quadrifolia",
    "18075:callitriche-stagnalis",
    "18075:marsilea-quadrifolia",
    "18077:callitriche-stagnalis",
    "18077:marsilea-quadrifolia",
    "18079:callitriche-stagnalis",
    "18079:marsilea-quadrifolia",
    "18081:callitriche-stagnalis",
    "18081:marsilea-quadrifolia",
    "18083:callitriche-stagnalis",
    "18083:marsilea-quadrifolia",
    "18085:callitriche-stagnalis",
    "18085:marsilea-quadrifolia",
    "18087:callitriche-stagnalis",
    "18087:marsilea-quadrifolia",
    "18089:callitriche-stagnalis",
    "18089:marsilea-quadrifolia",
    "18091:callitriche-stagnalis",
    "18091:marsilea-quadrifolia",
    "18093:callitriche-stagnalis",
    "18093:marsilea-quadrifolia",
    "18095:callitriche-stagnalis",
    "18095:marsilea-quadrifolia",
    "18097:callitriche-stagnalis",
    "18097:marsilea-quadrifolia",
    "18099:callitriche-stagnalis",
    "18099:marsilea-quadrifolia",
    "18101:callitriche-stagnalis",
    "18101:marsilea-quadrifolia",
    "18103:callitriche-stagnalis",
    "18103:marsilea-quadrifolia",
    "18105:callitriche-stagnalis",
    "18105:marsilea-quadrifolia",
    "18107:callitriche-stagnalis",
    "18107:marsilea-quadrifolia",
    "18109:callitriche-stagnalis",
    "18109:marsilea-quadrifolia",
    "18111:callitriche-stagnalis",
    "18111:marsilea-quadrifolia",
    "18113:callitriche-stagnalis",
    "18113:marsilea-quadrifolia",
    "18115:callitriche-stagnalis",
    "18115:marsilea-quadrifolia",
    "18117:callitriche-stagnalis",
    "18117:marsilea-quadrifolia",
    "18119:callitriche-stagnalis",
    "18119:marsilea-quadrifolia",
    "18121:callitriche-stagnalis",
    "18121:marsilea-quadrifolia",
    "18123:callitriche-stagnalis",
    "18123:marsilea-quadrifolia",
    "18125:callitriche-stagnalis",
    "18125:marsilea-quadrifolia",
    "18127:callitriche-stagnalis",
    "18127:marsilea-quadrifolia",
    "18129:callitriche-stagnalis",
    "18129:marsilea-quadrifolia",
    "18131:callitriche-stagnalis",
    "18131:marsilea-quadrifolia",
    "18133:callitriche-stagnalis",
    "18133:marsilea-quadrifolia",
    "18135:callitriche-stagnalis",
    "18135:marsilea-quadrifolia",
    "18137:callitriche-stagnalis",
    "18137:marsilea-quadrifolia",
    "18139:callitriche-stagnalis",
    "18139:marsilea-quadrifolia",
    "18141:callitriche-stagnalis",
    "18141:marsilea-quadrifolia",
    "18143:callitriche-stagnalis",
    "18143:marsilea-quadrifolia",
    "18145:callitriche-stagnalis",
    "18145:marsilea-quadrifolia",
    "18147:callitriche-stagnalis",
    "18147:marsilea-quadrifolia",
    "18149:callitriche-stagnalis",
    "18149:marsilea-quadrifolia",
    "18151:callitriche-stagnalis",
    "18151:marsilea-quadrifolia",
    "18153:callitriche-stagnalis",
    "18153:marsilea-quadrifolia",
    "18155:callitriche-stagnalis",
    "18155:marsilea-quadrifolia",
    "18157:callitriche-stagnalis",
    "18157:marsilea-quadrifolia",
    "18159:callitriche-stagnalis",
    "18159:marsilea-quadrifolia",
    "18161:callitriche-stagnalis",
    "18161:marsilea-quadrifolia",
    "18163:callitriche-stagnalis",
    "18163:marsilea-quadrifolia",
    "18165:callitriche-stagnalis",
    "18165:marsilea-quadrifolia",
    "18167:callitriche-stagnalis",
    "18167:marsilea-quadrifolia",
    "18169:callitriche-stagnalis",
    "18169:marsilea-quadrifolia",
    "18171:callitriche-stagnalis",
    "18171:marsilea-quadrifolia",
    "18173:callitriche-stagnalis",
    "18173:marsilea-quadrifolia",
    "18175:callitriche-stagnalis",
    "18175:marsilea-quadrifolia",
    "18177:callitriche-stagnalis",
    "18177:marsilea-quadrifolia",
    "18179:callitriche-stagnalis",
    "18179:marsilea-quadrifolia",
    "18181:callitriche-stagnalis",
    "18181:marsilea-quadrifolia",
    "18183:callitriche-stagnalis",
    "18183:marsilea-quadrifolia"
  ],
  "parameterHash": "3b1d3fb84c0fe4ecae25f17bc68cbc78ce65a7d6d19c5f366088163482822a2a",
  "authority": {
    "name": "Global Biodiversity Information Facility",
    "sourceUrl": "https://www.gbif.org/occurrence/download/0021178-260806074905277",
    "publisher": "GBIF"
  },
  "terms": {
    "license": "http://creativecommons.org/licenses/by-nc/4.0/legalcode",
    "termsUrl": "https://www.gbif.org/terms",
    "retentionAllowed": true
  },
  "availability": {
    "status": "available",
    "checkedAt": "2026-08-18T01:56:24.535Z",
    "freshnessDate": "2026-08-17"
  },
  "geography": {
    "method": "Exact provider-declared state and county text resolved through the active Census county-equivalent registry.",
    "countyEquivalentSupported": true,
    "coordinatePolicy": "Coordinates never establish county membership; missing, ambiguous, contradictory, or retired geography is rejected."
  },
  "taxonomy": {
    "method": "Exact retained GBIF species keys from a hash-pinned taxonomy cache with EXACT species matches and confidence at least 95.",
    "targetSpeciesIds": [
      "callitriche-stagnalis",
      "marsilea-quadrifolia"
    ]
  },
  "acquisition": {
    "snapshotComplete": true,
    "paginationComplete": true,
    "stableIdentityFields": [
      "gbifID",
      "datasetKey",
      "speciesKey",
      "stateProvince",
      "county"
    ],
    "requests": [
      {
        "requestGroupId": "20260818t015248z__gbif-download__3adc41198e1b",
        "url": "https://api.gbif.org/v1/occurrence/download/request/0021178-260806074905277.zip",
        "purpose": "Authenticated provider-native national Darwin Core archive reused by this offline state partition",
        "attempts": 1,
        "status": 200,
        "retrievedAt": "2026-08-18T01:56:20.491Z",
        "declaredRecordCount": 30994,
        "receivedRecordCount": 30994,
        "pagination": {
          "mode": "snapshot",
          "pageIndex": 0,
          "offset": null,
          "limit": null,
          "cursor": null,
          "nextCursor": null,
          "endOfRecords": true
        }
      }
    ]
  },
  "negativeEvidence": {
    "supportsVerifiedAbsence": false,
    "supportsNotDetected": false,
    "limitations": [
      "GBIF preserved specimen records are positive occurrence evidence, not a negative survey.",
      "Complete archive silence changes research status only; failure, rejection, and missing geography create no negative claim."
    ]
  },
  "retainedEvidence": [
    {
      "path": "src/data/research/runs/20260818T015248Z__gbif-preserved-specimens__900d2990fb62/artifacts/national-acquisition-reference.json",
      "sha256": "6a52157b6ebf87570db5aabf01bdb347e6ad12bff512356ed1255cd044445233",
      "bytes": 24977
    }
  ],
  "caveats": [
    "Preserved specimen evidence only. Publisher records can contain taxonomic and geospatial issues.",
    "The archive uses deliberately retained legacy GBIF Backbone identifiers; Catalogue of Life migration is separate work.",
    "At most one deterministic qualifying specimen assertion is published per selected county-species pair."
  ]
}
